{
 "status": "complete",
 "run_id": "scan",
 "finished": "2026-10-12T06:29:50+00:00",
 "target_url": "https://vayu-pramaan.vercel.app",
 "commit": "99b74605c77527fc0e54c86570d93204177ff047",
 "verdict": "ship",
 "duration_s": 342,
 "stats": {
  "steps": 45,
  "states": 2,
  "edges": 45,
  "bugs": 1,
  "tierCounts": {
   "heuristic": 0,
   "ranker": 0,
   "llm": 0,
   "fallback": 45
  },
  "heals": {
   "exact": 45,
   "healed": 0,
   "failed": 0
  },
  "llmCalls": 0,
  "elapsedMs": 304723,
  "stepP50Ms": 5117,
  "stepP95Ms": 6247
 },
 "bugs": [
  {
   "id": "NLE-001",
   "title": "Failed API request on / after \u201cSearch\u201d",
   "type": "network_failure",
   "severity": "major",
   "status": "unverified",
   "confirmations": "0/3",
   "foundAtStep": 1,
   "url": "https://vayu-pramaan.vercel.app/",
   "message": "GET /elevation-tiles-prod/terrarium/9/366/211.png failed: net::ERR_ABORTED",
   "steps": [
    "Open https://vayu-pramaan.vercel.app/",
    "Click \u201cSearch\u201d",
    "Observe: GET /elevation-tiles-prod/terrarium/9/366/211.png failed: net::ERR_ABORTED"
   ]
  }
 ],
 "history": [
  {
   "run_id": "scan",
   "finished": "2026-09-27T22:38:55+00:00",
   "verdict": "ship",
   "steps": 45,
   "states": 2,
   "bugs": 0,
   "duration_s": 308,
   "commit": "f03141423f7be0a16104b21c6a682036ac9e1398"
  },
  {
   "run_id": "scan",
   "finished": "2026-09-27T23:00:16+00:00",
   "verdict": "ship",
   "steps": 45,
   "states": 2,
   "bugs": 1,
   "duration_s": 330,
   "commit": "14de20e0ff9dde65826d54593dc40b5010feec01"
  },
  {
   "run_id": "scan",
   "finished": "2026-09-27T23:28:43+00:00",
   "verdict": "ship",
   "steps": 45,
   "states": 2,
   "bugs": 1,
   "duration_s": 347,
   "commit": "82d21d77775f2800afa7769ebe2574c2645da936"
  },
  {
   "run_id": "scan",
   "finished": "2026-09-28T00:33:40+00:00",
   "verdict": "ship",
   "steps": 45,
   "states": 2,
   "bugs": 1,
   "duration_s": 345,
   "commit": "924dad616d03cc6be92f6254e5164f843185229e"
  },
  {
   "run_id": "scan",
   "finished": "2026-09-28T05:51:38+00:00",
   "verdict": "ship",
   "steps": 45,
   "states": 2,
   "bugs": 1,
   "duration_s": 336,
   "commit": "0e7c16bb291800eaf917af3d0e8dd6345ba99089"
  },
  {
   "run_id": "scan",
   "finished": "2026-09-30T05:58:38+00:00",
   "verdict": "ship",
   "steps": 45,
   "states": 2,
   "bugs": 1,
   "duration_s": 330,
   "commit": "0b5fc96fb95ed907448504b618c62beca41af284"
  },
  {
   "run_id": "scan",
   "finished": "2026-10-01T06:32:08+00:00",
   "verdict": "ship",
   "steps": 45,
   "states": 2,
   "bugs": 1,
   "duration_s": 355,
   "commit": "2d02b7b6cf2524ad0dc6559ed4e79e73b9403f03"
  },
  {
   "run_id": "scan",
   "finished": "2026-10-02T06:10:04+00:00",
   "verdict": "ship",
   "steps": 45,
   "states": 2,
   "bugs": 2,
   "duration_s": 383,
   "commit": "10d74cdf6f6f4ee5e11d57ac5cffd6f35003fe2a"
  },
  {
   "run_id": "scan",
   "finished": "2026-10-03T05:44:03+00:00",
   "verdict": "ship",
   "steps": 45,
   "states": 2,
   "bugs": 0,
   "duration_s": 308,
   "commit": "dda8fe5a817988d69fb8cf0220f90ee2d7960461"
  },
  {
   "run_id": "scan",
   "finished": "2026-10-04T06:19:32+00:00",
   "verdict": "ship",
   "steps": 45,
   "states": 2,
   "bugs": 0,
   "duration_s": 311,
   "commit": "a45faaa4de6e59cab33cd7e6251f775c06ec503e"
  },
  {
   "run_id": "scan",
   "finished": "2026-10-05T06:12:24+00:00",
   "verdict": "ship",
   "steps": 45,
   "states": 2,
   "bugs": 2,
   "duration_s": 333,
   "commit": "3d12afc4ebd92c1930b5ea8a3a4e1e9cebbdcd8f"
  },
  {
   "run_id": "scan",
   "finished": "2026-10-06T06:52:04+00:00",
   "verdict": "ship",
   "steps": 45,
   "states": 2,
   "bugs": 2,
   "duration_s": 328,
   "commit": "f80f9cb305d93e8ce00f58795b7e63433a0d46a6"
  },
  {
   "run_id": "scan",
   "finished": "2026-10-08T06:38:49+00:00",
   "verdict": "ship",
   "steps": 45,
   "states": 2,
   "bugs": 1,
   "duration_s": 304,
   "commit": "9d3c05e9872b7bccf513c85a5fbea9ceeb00e153"
  },
  {
   "run_id": "scan",
   "finished": "2026-10-09T06:39:31+00:00",
   "verdict": "ship",
   "steps": 45,
   "states": 2,
   "bugs": 1,
   "duration_s": 318,
   "commit": "2d3a0797f9ebd2356067935e449d47821cead16a"
  },
  {
   "run_id": "scan",
   "finished": "2026-10-10T06:22:04+00:00",
   "verdict": "ship",
   "steps": 45,
   "states": 2,
   "bugs": 1,
   "duration_s": 303,
   "commit": "7e043d2f6947efcb2f54af551f688fcaf12e9659"
  },
  {
   "run_id": "scan",
   "finished": "2026-10-11T06:21:32+00:00",
   "verdict": "ship",
   "steps": 45,
   "states": 2,
   "bugs": 1,
   "duration_s": 335,
   "commit": "2f9934469c2874c9455d8177cc044057c67fd42d"
  },
  {
   "run_id": "scan",
   "finished": "2026-10-12T06:29:50+00:00",
   "verdict": "ship",
   "steps": 45,
   "states": 2,
   "bugs": 1,
   "duration_s": 342,
   "commit": "99b74605c77527fc0e54c86570d93204177ff047"
  }
 ]
}